{
  "$schema": "https://json-schema.org/draft/2020-12/schema",
  "$id": "https://tio2malaysia.com/internal/schemas/gate8-evidence-manifest-v1.0.json",
  "title": "Gate8 Evidence Manifest V1.0",
  "type": "object",
  "additionalProperties": false,
  "required": ["schema_version", "handoff_id", "gate8_task_id", "site_scope", "receipt_path", "pages", "git", "build", "runtime", "evidence", "receipt_evidence_references", "known_open_items"],
  "properties": {
    "schema_version": { "const": "gate8-evidence-manifest-v1.0" },
    "handoff_id": { "type": "string", "minLength": 1 },
    "gate8_task_id": { "type": "string", "minLength": 1 },
    "site_scope": { "type": "string", "minLength": 1 },
    "receipt_path": { "type": "string", "minLength": 1 },
    "pages": {
      "type": "array",
      "minItems": 1,
      "items": {
        "type": "object",
        "additionalProperties": false,
        "required": ["page_id", "acceptance_condition_ids", "runtime_path"],
        "properties": {
          "page_id": { "type": "string", "minLength": 1 },
          "acceptance_condition_ids": { "type": "array", "minItems": 1, "items": { "type": "string", "minLength": 1 }, "uniqueItems": true },
          "runtime_path": { "type": "string", "pattern": "^/" }
        }
      }
    },
    "git": {
      "type": "object",
      "additionalProperties": false,
      "required": ["repository", "branch", "baseline_commit", "implementation_commit", "evidence_head", "clean_checked_at"],
      "properties": {
        "repository": { "type": "string", "minLength": 1 },
        "branch": { "type": "string", "minLength": 1 },
        "baseline_commit": { "type": "string", "pattern": "^[0-9a-fA-F]{7,40}$" },
        "implementation_commit": { "type": "string", "pattern": "^[0-9a-fA-F]{7,40}$" },
        "evidence_head": { "type": "string", "pattern": "^[0-9a-fA-F]{7,40}$" },
        "clean_checked_at": { "type": "string", "format": "date-time" }
      }
    },
    "build": {
      "type": "object",
      "additionalProperties": false,
      "required": ["directory", "build_id", "implementation_commit"],
      "properties": {
        "directory": { "type": "string", "minLength": 1 },
        "build_id": { "type": "string", "minLength": 1 },
        "implementation_commit": { "type": "string", "pattern": "^[0-9a-fA-F]{7,40}$" }
      }
    },
    "runtime": {
      "type": "object",
      "additionalProperties": false,
      "required": ["base_url", "site_scope", "environment_type", "started_at", "hold_until", "checks"],
      "properties": {
        "base_url": { "type": "string", "pattern": "^https?://" },
        "site_scope": { "type": "string", "minLength": 1 },
        "environment_type": { "type": "string", "enum": ["local-production", "local-preview", "staging", "production"] },
        "started_at": { "type": "string", "format": "date-time" },
        "hold_until": { "const": "GATE9_PASS_OR_RETURN_NOTICE" },
        "require_build_marker": { "type": "boolean", "default": true },
        "checks": {
          "type": "array",
          "minItems": 1,
          "items": {
            "type": "object",
            "additionalProperties": false,
            "required": ["path", "expected_status", "contains"],
            "properties": {
              "path": { "type": "string", "pattern": "^/" },
              "expected_status": { "type": "integer", "minimum": 100, "maximum": 599 },
              "contains": { "type": "array", "minItems": 1, "items": { "type": "string", "minLength": 1 } }
            }
          }
        }
      }
    },
    "evidence": {
      "type": "array",
      "minItems": 1,
      "items": {
        "type": "object",
        "additionalProperties": false,
        "required": ["path", "sha256", "evidence_type", "proves", "command", "environment"],
        "properties": {
          "path": { "type": "string", "minLength": 1 },
          "sha256": { "type": "string", "pattern": "^[0-9a-fA-F]{64}$" },
          "evidence_type": { "type": "string", "enum": ["ACTUAL_RUNTIME", "STATIC_VISUAL", "SOURCE_INSPECTION", "LOCAL_SIMULATION", "TEST_RESULT", "IDENTITY", "RECEIVER"] },
          "proves": { "type": "array", "minItems": 1, "items": { "type": "string", "minLength": 1 } },
          "command": { "type": "string", "minLength": 1 },
          "environment": { "type": "string", "minLength": 1 }
        }
      }
    },
    "receipt_evidence_references": { "type": "array", "items": { "type": "string", "minLength": 1 }, "uniqueItems": true },
    "known_open_items": {
      "type": "array",
      "items": {
        "type": "object",
        "additionalProperties": false,
        "required": ["id", "owner", "blocking_layer", "closure_evidence", "closure_timing"],
        "properties": {
          "id": { "type": "string", "minLength": 1 },
          "owner": { "type": "string", "minLength": 1 },
          "blocking_layer": { "type": "string", "enum": ["RECHECK_SCOPE", "PAGE_GATE9", "INTEGRATION", "RELEASE"] },
          "closure_evidence": { "type": "string", "minLength": 1 },
          "closure_timing": { "type": "string", "minLength": 1 }
        }
      }
    }
  }
}
