{
  "schema_version": "gate8-evidence-manifest-v1.0",
  "handoff_id": "PRERELEASE-3100-IL-G8-REPAIR-20260910-01",
  "gate8_task_id": "01a07e6a-546d-7532-aa06-02d2bffd5eed",
  "site_scope": "tio2-my",
  "receipt_path": "docs/verification/prerelease-3100-internal-links/gate8/GATE8_REPAIR_RECEIPT_2026-09-10.md",
  "pages": [
    {
      "page_id": "HOME-001",
      "acceptance_condition_ids": [
        "ILR3100-F01-CANONICAL-REDIRECT-PARITY"
      ],
      "runtime_path": "/"
    },
    {
      "page_id": "ABOUT-001",
      "acceptance_condition_ids": [
        "ILR3100-F01-CANONICAL-REDIRECT-PARITY"
      ],
      "runtime_path": "/about/"
    },
    {
      "page_id": "MARKET-000",
      "acceptance_condition_ids": [
        "ILR3100-F01-CANONICAL-REDIRECT-PARITY"
      ],
      "runtime_path": "/markets/"
    },
    {
      "page_id": "MARKET-EU-001",
      "acceptance_condition_ids": [
        "ILR3100-F01-CANONICAL-REDIRECT-PARITY"
      ],
      "runtime_path": "/markets/european-union/"
    },
    {
      "page_id": "MARKET-EU-DE",
      "acceptance_condition_ids": [
        "ILR3100-F01-CANONICAL-REDIRECT-PARITY"
      ],
      "runtime_path": "/markets/germany/"
    },
    {
      "page_id": "MARKET-EU-IT",
      "acceptance_condition_ids": [
        "ILR3100-F01-CANONICAL-REDIRECT-PARITY"
      ],
      "runtime_path": "/markets/italy/"
    },
    {
      "page_id": "MARKET-EU-ES",
      "acceptance_condition_ids": [
        "ILR3100-F01-CANONICAL-REDIRECT-PARITY"
      ],
      "runtime_path": "/markets/spain/"
    },
    {
      "page_id": "MARKET-EU-PL",
      "acceptance_condition_ids": [
        "ILR3100-F01-CANONICAL-REDIRECT-PARITY"
      ],
      "runtime_path": "/markets/poland/"
    },
    {
      "page_id": "MARKET-EU-NL",
      "acceptance_condition_ids": [
        "ILR3100-F01-CANONICAL-REDIRECT-PARITY"
      ],
      "runtime_path": "/markets/netherlands/"
    },
    {
      "page_id": "MARKET-EU-BE",
      "acceptance_condition_ids": [
        "ILR3100-F01-CANONICAL-REDIRECT-PARITY"
      ],
      "runtime_path": "/markets/belgium/"
    },
    {
      "page_id": "MARKET-UK-001",
      "acceptance_condition_ids": [
        "ILR3100-F01-CANONICAL-REDIRECT-PARITY"
      ],
      "runtime_path": "/markets/united-kingdom/"
    },
    {
      "page_id": "MARKET-IN-001",
      "acceptance_condition_ids": [
        "ILR3100-F01-CANONICAL-REDIRECT-PARITY"
      ],
      "runtime_path": "/markets/india/"
    },
    {
      "page_id": "MARKET-BR-EN",
      "acceptance_condition_ids": [
        "ILR3100-F01-CANONICAL-REDIRECT-PARITY"
      ],
      "runtime_path": "/markets/brazil/"
    },
    {
      "page_id": "MARKET-BR-PT",
      "acceptance_condition_ids": [
        "ILR3100-F01-CANONICAL-REDIRECT-PARITY"
      ],
      "runtime_path": "/pt-br/markets/brazil/"
    },
    {
      "page_id": "PRODUCT-000",
      "acceptance_condition_ids": [
        "ILR3100-F01-CANONICAL-REDIRECT-PARITY"
      ],
      "runtime_path": "/products/"
    },
    {
      "page_id": "PRODUCT-PROC-CL",
      "acceptance_condition_ids": [
        "ILR3100-F01-CANONICAL-REDIRECT-PARITY"
      ],
      "runtime_path": "/products/chloride-process-titanium-dioxide/"
    },
    {
      "page_id": "PRODUCT-PROC-SU",
      "acceptance_condition_ids": [
        "ILR3100-F01-CANONICAL-REDIRECT-PARITY"
      ],
      "runtime_path": "/products/sulfate-process-titanium-dioxide/"
    },
    {
      "page_id": "GRADE-M350",
      "acceptance_condition_ids": [
        "ILR3100-F01-CANONICAL-REDIRECT-PARITY"
      ],
      "runtime_path": "/products/m-350/"
    },
    {
      "page_id": "GRADE-M510",
      "acceptance_condition_ids": [
        "ILR3100-F01-CANONICAL-REDIRECT-PARITY"
      ],
      "runtime_path": "/products/m-510/"
    },
    {
      "page_id": "GRADE-M896",
      "acceptance_condition_ids": [
        "ILR3100-F01-CANONICAL-REDIRECT-PARITY"
      ],
      "runtime_path": "/products/m-896/"
    },
    {
      "page_id": "GRADE-M996",
      "acceptance_condition_ids": [
        "ILR3100-F01-CANONICAL-REDIRECT-PARITY"
      ],
      "runtime_path": "/products/m-996/"
    },
    {
      "page_id": "GRADE-M2196",
      "acceptance_condition_ids": [
        "ILR3100-F01-CANONICAL-REDIRECT-PARITY"
      ],
      "runtime_path": "/products/m-2196/"
    },
    {
      "page_id": "GRADE-M895",
      "acceptance_condition_ids": [
        "ILR3100-F01-CANONICAL-REDIRECT-PARITY"
      ],
      "runtime_path": "/products/m-895/"
    },
    {
      "page_id": "GRADE-M200",
      "acceptance_condition_ids": [
        "ILR3100-F01-CANONICAL-REDIRECT-PARITY"
      ],
      "runtime_path": "/products/m-200/"
    },
    {
      "page_id": "GRADE-M108",
      "acceptance_condition_ids": [
        "ILR3100-F01-CANONICAL-REDIRECT-PARITY"
      ],
      "runtime_path": "/products/m-108/"
    },
    {
      "page_id": "GRADE-M210",
      "acceptance_condition_ids": [
        "ILR3100-F01-CANONICAL-REDIRECT-PARITY"
      ],
      "runtime_path": "/products/m-210/"
    },
    {
      "page_id": "GRADE-M340",
      "acceptance_condition_ids": [
        "ILR3100-F01-CANONICAL-REDIRECT-PARITY"
      ],
      "runtime_path": "/products/m-340/"
    },
    {
      "page_id": "GRADE-M886",
      "acceptance_condition_ids": [
        "ILR3100-F01-CANONICAL-REDIRECT-PARITY"
      ],
      "runtime_path": "/products/m-886/"
    },
    {
      "page_id": "GRADE-M52",
      "acceptance_condition_ids": [
        "ILR3100-F01-CANONICAL-REDIRECT-PARITY"
      ],
      "runtime_path": "/products/m-52/"
    },
    {
      "page_id": "GRADE-M2377",
      "acceptance_condition_ids": [
        "ILR3100-F01-CANONICAL-REDIRECT-PARITY"
      ],
      "runtime_path": "/products/m-2377/"
    },
    {
      "page_id": "GRADE-CR901",
      "acceptance_condition_ids": [
        "ILR3100-F01-CANONICAL-REDIRECT-PARITY"
      ],
      "runtime_path": "/products/cr-901/"
    },
    {
      "page_id": "APP-000",
      "acceptance_condition_ids": [
        "ILR3100-F01-CANONICAL-REDIRECT-PARITY"
      ],
      "runtime_path": "/applications/"
    },
    {
      "page_id": "APP-COAT",
      "acceptance_condition_ids": [
        "ILR3100-F01-CANONICAL-REDIRECT-PARITY"
      ],
      "runtime_path": "/applications/titanium-dioxide-for-coatings/"
    },
    {
      "page_id": "APP-PLAS",
      "acceptance_condition_ids": [
        "ILR3100-F01-CANONICAL-REDIRECT-PARITY"
      ],
      "runtime_path": "/applications/titanium-dioxide-for-plastics/"
    },
    {
      "page_id": "APP-MB",
      "acceptance_condition_ids": [
        "ILR3100-F01-CANONICAL-REDIRECT-PARITY"
      ],
      "runtime_path": "/applications/titanium-dioxide-for-masterbatch/"
    },
    {
      "page_id": "APP-INK",
      "acceptance_condition_ids": [
        "ILR3100-F01-CANONICAL-REDIRECT-PARITY"
      ],
      "runtime_path": "/applications/titanium-dioxide-for-printing-inks/"
    },
    {
      "page_id": "APP-PAPER",
      "acceptance_condition_ids": [
        "ILR3100-F01-CANONICAL-REDIRECT-PARITY"
      ],
      "runtime_path": "/applications/titanium-dioxide-for-paper/"
    },
    {
      "page_id": "DOC-000",
      "acceptance_condition_ids": [
        "ILR3100-F01-CANONICAL-REDIRECT-PARITY"
      ],
      "runtime_path": "/documents/"
    },
    {
      "page_id": "DOC-REACH",
      "acceptance_condition_ids": [
        "ILR3100-F01-CANONICAL-REDIRECT-PARITY"
      ],
      "runtime_path": "/documents/reach/"
    },
    {
      "page_id": "DOC-TDS",
      "acceptance_condition_ids": [
        "ILR3100-F01-CANONICAL-REDIRECT-PARITY"
      ],
      "runtime_path": "/documents/tds-sds-coa/"
    },
    {
      "page_id": "DOC-COO",
      "acceptance_condition_ids": [
        "ILR3100-F01-CANONICAL-REDIRECT-PARITY"
      ],
      "runtime_path": "/documents/certificate-of-origin/"
    },
    {
      "page_id": "RES-000",
      "acceptance_condition_ids": [
        "ILR3100-F01-CANONICAL-REDIRECT-PARITY"
      ],
      "runtime_path": "/resources/"
    },
    {
      "page_id": "RES-ORIGIN",
      "acceptance_condition_ids": [
        "ILR3100-F01-CANONICAL-REDIRECT-PARITY"
      ],
      "runtime_path": "/resources/non-china-titanium-dioxide/"
    },
    {
      "page_id": "RES-PROC",
      "acceptance_condition_ids": [
        "ILR3100-F01-CANONICAL-REDIRECT-PARITY"
      ],
      "runtime_path": "/resources/chloride-vs-sulfate-titanium-dioxide/"
    },
    {
      "page_id": "RES-CHEMOURS",
      "acceptance_condition_ids": [
        "ILR3100-F01-CANONICAL-REDIRECT-PARITY"
      ],
      "runtime_path": "/resources/chemours-titanium-dioxide-alternatives/"
    },
    {
      "page_id": "RES-R706",
      "acceptance_condition_ids": [
        "ILR3100-F01-CANONICAL-REDIRECT-PARITY"
      ],
      "runtime_path": "/resources/ti-pure-r-706-alternative/"
    },
    {
      "page_id": "RES-TRADE-EU",
      "acceptance_condition_ids": [
        "ILR3100-F01-CANONICAL-REDIRECT-PARITY"
      ],
      "runtime_path": "/resources/eu-titanium-dioxide-anti-dumping-duty/"
    },
    {
      "page_id": "RES-TRADE-UK",
      "acceptance_condition_ids": [
        "ILR3100-F01-CANONICAL-REDIRECT-PARITY"
      ],
      "runtime_path": "/resources/uk-titanium-dioxide-anti-dumping-investigation/"
    },
    {
      "page_id": "RES-TRADE-IN",
      "acceptance_condition_ids": [
        "ILR3100-F01-CANONICAL-REDIRECT-PARITY"
      ],
      "runtime_path": "/resources/india-titanium-dioxide-anti-dumping-duty/"
    },
    {
      "page_id": "RES-TRADE-BR",
      "acceptance_condition_ids": [
        "ILR3100-F01-CANONICAL-REDIRECT-PARITY"
      ],
      "runtime_path": "/resources/brazil-titanium-dioxide-anti-dumping-duty/"
    },
    {
      "page_id": "CONV-DOC",
      "acceptance_condition_ids": [
        "ILR3100-F01-CANONICAL-REDIRECT-PARITY"
      ],
      "runtime_path": "/request-documents/"
    },
    {
      "page_id": "CONV-RFQ",
      "acceptance_condition_ids": [
        "ILR3100-F01-CANONICAL-REDIRECT-PARITY"